{
  "id": "TN-086",
  "state_code": "TN",
  "number": 86,
  "name": "Edappadi",
  "district": "Salem",
  "reservation": "GEN",
  "current_mla_id": "edappadi-k-palaniswami",
  "current_party_id": "AIADMK",
  "latest_election_year": 2021,
  "summary": "An AIADMK-held Salem district seat represented here by Edappadi K. Palaniswami for the pre-May-4, 2026 seed snapshot.",
  "_meta": {
    "source_note": "Constituency number cross-checked against the ECI 2021 Tamil Nadu general election PDF before seeding.",
    "sources": [
      {
        "url": "https://www.eci.gov.in/eci-backend/public/api/download?url=LMAhAK6sOPBp%2FNFF0iRfXbEB1EVSLT41NNLRjYNJJP1KivrUxbfqkDatmHy12e%2FzVx8fLfn2ReU7TfrqYobgIjqxF0Y30PrbSNHlx8A5OO79CAjyA1W7mQg6vNiyKblliln8kOp3b1lyKaqH5ioq9Oce%2BHqHMol3xcK0a3h7vjY%3D",
        "name": "Election Commission of India - 86 Edappadi listed in the 2021 Tamil Nadu General Election PDF",
        "retrieved_at": "2026-04-22T00:00:00+05:30"
      },
      {
        "url": "https://en.wikipedia.org/wiki/Edappadi_Assembly_constituency",
        "name": "Wikipedia - Edappadi Assembly constituency",
        "retrieved_at": "2026-04-22T00:00:00+05:30"
      }
    ]
  }
}
